{
 "schema_version": 1,
 "language": "python",
 "base_ref": "9d45962efcf863c3befa0b39d5748ede2ae5870e",
 "base_dir": "/base",
 "candidate_dir": "/cand",
 "changed_files": [
  "src/calc.py"
 ],
 "generators_override": null,
 "operation": "tier0",
 "budget": {
  "probes": [
   {
    "id": "BP-02",
    "description": "An empty list is rejected",
    "input": "media([])",
    "expected": "raises ValueError",
    "kind": "negative",
    "file": "src/calc.py",
    "expr": "raises(ValueError, media, [])"
   }
  ]
 }
}
